{
  "$schema": "https://json-schema.org/draft/2020-12/schema",
  "$id": "https://cdn.jsdelivr.net/gh/walktalkmeditate/open-pilgrimages@v1/schema/index.schema.json",
  "title": "Open Pilgrimages Route Index",
  "description": "Registry of all pilgrimage routes in the dataset",
  "type": "object",
  "required": ["schemaVersion", "release", "generatedAt", "routes"],
  "properties": {
    "schemaVersion": {
      "type": "string",
      "pattern": "^\\d+\\.\\d+\\.\\d+$",
      "description": "SemVer schema version"
    },
    "release": {
      "type": "string",
      "pattern": "^v\\d+\\.\\d+\\.\\d+$",
      "description": "The git tag this build will be released under. The app pins every package download to it."
    },
    "generatedAt": {
      "type": "string",
      "format": "date-time",
      "description": "ISO 8601 timestamp of generation"
    },
    "pilgrimages": {
      "type": "array",
      "items": {
        "type": "object",
        "required": ["id", "name", "kind", "sections"],
        "properties": {
          "id": { "type": "string", "pattern": "^[a-z0-9-]+$" },
          "name": { "$ref": "#/$defs/LocalizedString" },
          "kind": { "type": "string", "enum": ["legs", "alternatives"] },
          "sections": { "type": "array", "items": { "type": "string" }, "minItems": 1 },
          "distanceKm": { "type": "number", "minimum": 0 },
          "stageCount": { "type": "integer", "minimum": 0 },
          "stats": {
            "type": "object",
            "required": ["lastUpdated", "dataYear", "dataNote", "annualPilgrims"],
            "properties": {
              "lastUpdated": { "type": "string", "format": "date" },
              "dataYear": { "type": "integer" },
              "dataNote": { "type": "string" },
              "annualPilgrims": { "type": "object" }
            },
            "additionalProperties": true,
            "description": "Counts measured over the whole walk, copied verbatim from the sections' agreed `pilgrimage.stats` block. Absent for a pilgrimage whose sections carry none. `pilgrimage.schema.json` is where the full shape is stated and `validate` is what refuses sections that disagree; this restates only the keys a consumer may rely on, so the two files have no depths to drift over."
          }
        }
      }
    },
    "routes": {
      "type": "array",
      "items": { "$ref": "#/$defs/RouteEntry" }
    }
  },
  "$defs": {
    "LocalizedString": {
      "type": "object",
      "required": ["en"],
      "properties": {
        "en": { "type": "string" }
      },
      "additionalProperties": { "type": "string" },
      "description": "Localized string keyed by BCP 47 language tag. English required."
    },
    "RouteEntry": {
      "type": "object",
      "required": ["id", "name", "region", "country", "distanceKm", "topology", "tradition", "path"],
      "properties": {
        "id": {
          "type": "string",
          "pattern": "^[a-z0-9-]+$",
          "description": "Stable kebab-case route identifier"
        },
        "name": { "$ref": "#/$defs/LocalizedString" },
        "region": {
          "type": "string",
          "enum": ["Europe", "Asia", "Americas", "Africa", "Oceania", "Middle East"]
        },
        "country": {
          "type": "string",
          "pattern": "^[A-Z]{2}$",
          "description": "ISO 3166-1 alpha-2 country code"
        },
        "distanceKm": {
          "type": "number",
          "minimum": 0
        },
        "topology": {
          "type": "string",
          "enum": ["linear", "circular", "network"]
        },
        "tradition": {
          "type": "string",
          "enum": ["christian", "buddhist", "shinto", "multi-faith", "secular", "mixed"]
        },
        "path": {
          "type": "string",
          "description": "Relative path from repo root to route directory"
        },
        "pilgrimage": { "type": "string", "pattern": "^[a-z0-9-]+$" },
        "variants": {
          "type": "array",
          "items": {
            "type": "object",
            "required": ["id", "name", "distanceKm", "path"],
            "properties": {
              "id": {
                "type": "string",
                "pattern": "^[a-z0-9-]+$"
              },
              "name": { "$ref": "#/$defs/LocalizedString" },
              "distanceKm": {
                "type": "number",
                "minimum": 0
              },
              "path": { "type": "string" }
            },
            "additionalProperties": true
          }
        },
        "ways": {
          "type": "object",
          "required": ["stageCount", "bytes", "placesPerStage", "sparse"],
          "description": "Present only when every stage of the route's package cleared the length gate. Absent means the app hides the route. `sparse` is true when fewer than half the stages carry a place beyond the day's own start and end, and the app's card says so.",
          "properties": {
            "stageCount": { "type": "integer", "minimum": 1, "maximum": 200 },
            "bytes": { "type": "integer", "minimum": 1, "maximum": 52428800 },
            "placesPerStage": { "type": "number", "minimum": 0, "maximum": 200 },
            "sparse": { "type": "boolean" }
          },
          "additionalProperties": false
        }
      },
      "additionalProperties": true
    }
  },
  "additionalProperties": true
}
