{
  "schemaVersion": "1.0.0",
  "release": "v1.12.0",
  "generatedAt": "2026-10-26T20:18:54.339Z",
  "pilgrimages": [
    {
      "id": "camino-de-santiago",
      "name": {
        "en": "Camino de Santiago",
        "es": "Camino de Santiago"
      },
      "kind": "alternatives",
      "sections": [
        "camino-frances",
        "camino-norte",
        "camino-primitivo",
        "camino-ingles",
        "camino-portugues"
      ]
    },
    {
      "id": "kumano-kodo",
      "name": {
        "en": "Kumano Kodō",
        "ja": "熊野古道"
      },
      "kind": "alternatives",
      "sections": [
        "kumano-kodo-nakahechi",
        "kumano-kodo-kohechi",
        "kumano-kodo-iseji",
        "kumano-kodo-ohechi"
      ]
    },
    {
      "id": "shikoku-88",
      "name": {
        "en": "Shikoku 88 Temple Pilgrimage",
        "ja": "四国八十八箇所"
      },
      "kind": "legs",
      "sections": [
        "shikoku-88-awa",
        "shikoku-88-tosa",
        "shikoku-88-iyo",
        "shikoku-88-sanuki"
      ],
      "distanceKm": 1140.9,
      "stageCount": 40,
      "stats": {
        "lastUpdated": "2026-03-27",
        "dataYear": 2025,
        "dataNote": "Shikoku has no central pilgrim office. Walking/cycling completion data comes from the Omotenashi Network (Henro Ambassador certificates). Total pilgrim counts (all modes) are estimates only.",
        "annualPilgrims": {
          "latest": {
            "year": 2025,
            "count": 150000,
            "note": "Estimated total (all modes). Walking completions: 1,622."
          }
        }
      }
    },
    {
      "id": "st-olav-ways",
      "name": {
        "en": "St. Olav Ways",
        "nb": "St. Olavsvegene"
      },
      "kind": "alternatives",
      "sections": [
        "st-olav-ways-gudbrandsdalsleden"
      ]
    }
  ],
  "routes": [
    {
      "id": "camino-frances",
      "name": {
        "en": "Camino de Santiago (Frances)",
        "es": "Camino de Santiago (Francés)",
        "fr": "Chemin de Saint-Jacques (Voie française)",
        "gl": "Camiño de Santiago (Francés)",
        "ja": "サンティアゴ巡礼路（フランス人の道）"
      },
      "region": "Europe",
      "country": "ES",
      "distanceKm": 764,
      "topology": "linear",
      "tradition": "christian",
      "path": "routes/camino-frances",
      "pilgrimage": "camino-de-santiago",
      "ways": {
        "stageCount": 33,
        "bytes": 1050535,
        "placesPerStage": 0.1,
        "sparse": true
      }
    },
    {
      "id": "camino-ingles",
      "name": {
        "en": "Camino Inglés (English Way)",
        "es": "Camino Inglés",
        "gl": "Camiño Inglés",
        "ja": "イギリス人の道"
      },
      "region": "Europe",
      "country": "ES",
      "distanceKm": 112,
      "topology": "linear",
      "tradition": "christian",
      "path": "routes/camino-ingles",
      "pilgrimage": "camino-de-santiago",
      "variants": [
        {
          "id": "a-coruna",
          "name": {
            "en": "Camino Inglés from A Coruña",
            "es": "Camino Inglés desde A Coruña",
            "gl": "Camiño Inglés desde A Coruña"
          },
          "distanceKm": 75,
          "path": "routes/camino-ingles/variants/a-coruna"
        }
      ]
    },
    {
      "id": "camino-norte",
      "name": {
        "en": "Camino del Norte (Northern Way)",
        "es": "Camino del Norte",
        "eu": "Kostaldeko Donejakue bidea",
        "gl": "Camiño do Norte",
        "fr": "Chemin du Nord",
        "ja": "北の道"
      },
      "region": "Europe",
      "country": "ES",
      "distanceKm": 788,
      "topology": "linear",
      "tradition": "christian",
      "path": "routes/camino-norte",
      "pilgrimage": "camino-de-santiago",
      "ways": {
        "stageCount": 34,
        "bytes": 1385811,
        "placesPerStage": 4.1,
        "sparse": false
      }
    },
    {
      "id": "camino-portugues",
      "name": {
        "en": "Camino Portugués (Central)",
        "pt": "Caminho Português (Central)",
        "es": "Camino Portugués (Central)",
        "gl": "Camiño Portugués (Central)",
        "ja": "ポルトガル人の道（中央ルート）"
      },
      "region": "Europe",
      "country": "ES",
      "distanceKm": 243,
      "topology": "linear",
      "tradition": "christian",
      "path": "routes/camino-portugues",
      "pilgrimage": "camino-de-santiago",
      "variants": [
        {
          "id": "coastal",
          "name": {
            "en": "Camino Portugués da Costa (Coastal — Portuguese section)",
            "pt": "Caminho Português da Costa (trecho português)",
            "es": "Camino Portugués de la Costa (tramo portugués)",
            "gl": "Camiño Portugués da Costa (treito portugués)"
          },
          "distanceKm": 110,
          "path": "routes/camino-portugues/variants/coastal"
        },
        {
          "id": "espiritual",
          "name": {
            "en": "Variante Espiritual (Spiritual Variant)",
            "pt": "Variante Espiritual",
            "es": "Variante Espiritual",
            "gl": "Variante Espiritual"
          },
          "distanceKm": 73,
          "path": "routes/camino-portugues/variants/espiritual"
        },
        {
          "id": "lisboa",
          "name": {
            "en": "Camino Portugués from Lisbon",
            "pt": "Caminho Português desde Lisboa",
            "es": "Camino Portugués desde Lisboa",
            "gl": "Camiño Portugués desde Lisboa"
          },
          "distanceKm": 620,
          "path": "routes/camino-portugues/variants/lisboa"
        }
      ]
    },
    {
      "id": "camino-primitivo",
      "name": {
        "en": "Camino Primitivo (Original Way)",
        "es": "Camino Primitivo",
        "ast": "Camín Primitivu",
        "gl": "Camiño Primitivo",
        "ja": "プリミティーボの道"
      },
      "region": "Europe",
      "country": "ES",
      "distanceKm": 263,
      "topology": "linear",
      "tradition": "christian",
      "path": "routes/camino-primitivo",
      "pilgrimage": "camino-de-santiago"
    },
    {
      "id": "kumano-kodo-iseji",
      "name": {
        "en": "Iseji (Eastern/Coastal Route)",
        "ja": "伊勢路"
      },
      "region": "Asia",
      "country": "JP",
      "distanceKm": 170,
      "topology": "linear",
      "tradition": "mixed",
      "path": "routes/kumano-kodo-iseji",
      "pilgrimage": "kumano-kodo"
    },
    {
      "id": "kumano-kodo-kohechi",
      "name": {
        "en": "Kohechi (Mountain Route)",
        "ja": "小辺路"
      },
      "region": "Asia",
      "country": "JP",
      "distanceKm": 63,
      "topology": "linear",
      "tradition": "mixed",
      "path": "routes/kumano-kodo-kohechi",
      "pilgrimage": "kumano-kodo",
      "ways": {
        "stageCount": 4,
        "bytes": 80961,
        "placesPerStage": 0.8,
        "sparse": false
      }
    },
    {
      "id": "kumano-kodo-nakahechi",
      "name": {
        "en": "Nakahechi (Central Route)",
        "ja": "中辺路"
      },
      "region": "Asia",
      "country": "JP",
      "distanceKm": 36,
      "topology": "network",
      "tradition": "mixed",
      "path": "routes/kumano-kodo-nakahechi",
      "pilgrimage": "kumano-kodo",
      "ways": {
        "stageCount": 4,
        "bytes": 65104,
        "placesPerStage": 2.5,
        "sparse": false
      }
    },
    {
      "id": "kumano-kodo-ohechi",
      "name": {
        "en": "Ōhechi (Southern Coastal Route)",
        "ja": "大辺路"
      },
      "region": "Asia",
      "country": "JP",
      "distanceKm": 90,
      "topology": "linear",
      "tradition": "mixed",
      "path": "routes/kumano-kodo-ohechi",
      "pilgrimage": "kumano-kodo"
    },
    {
      "id": "shikoku-88-awa",
      "name": {
        "en": "Awa (Temples 1-23)"
      },
      "region": "Asia",
      "country": "JP",
      "distanceKm": 154.5,
      "topology": "linear",
      "tradition": "buddhist",
      "path": "routes/shikoku-88-awa",
      "pilgrimage": "shikoku-88",
      "ways": {
        "stageCount": 5,
        "bytes": 176127,
        "placesPerStage": 5,
        "sparse": false
      }
    },
    {
      "id": "shikoku-88-iyo",
      "name": {
        "en": "Iyo (Temples 39-65)"
      },
      "region": "Asia",
      "country": "JP",
      "distanceKm": 365.7,
      "topology": "linear",
      "tradition": "buddhist",
      "path": "routes/shikoku-88-iyo",
      "pilgrimage": "shikoku-88",
      "ways": {
        "stageCount": 14,
        "bytes": 481988,
        "placesPerStage": 2.1,
        "sparse": false
      }
    },
    {
      "id": "shikoku-88-sanuki",
      "name": {
        "en": "Sanuki (Temples 65-88, and the return to Temple 1)"
      },
      "region": "Asia",
      "country": "JP",
      "distanceKm": 202.2,
      "topology": "linear",
      "tradition": "buddhist",
      "path": "routes/shikoku-88-sanuki",
      "pilgrimage": "shikoku-88",
      "ways": {
        "stageCount": 6,
        "bytes": 261012,
        "placesPerStage": 4.7,
        "sparse": false
      }
    },
    {
      "id": "shikoku-88-tosa",
      "name": {
        "en": "Tosa (Temples 23-39)"
      },
      "region": "Asia",
      "country": "JP",
      "distanceKm": 418.5,
      "topology": "linear",
      "tradition": "buddhist",
      "path": "routes/shikoku-88-tosa",
      "pilgrimage": "shikoku-88",
      "ways": {
        "stageCount": 15,
        "bytes": 388834,
        "placesPerStage": 1.6,
        "sparse": false
      }
    },
    {
      "id": "st-olav-ways-gudbrandsdalsleden",
      "name": {
        "en": "Gudbrandsdalsleden",
        "nb": "Gudbrandsdalsleden"
      },
      "region": "Europe",
      "country": "NO",
      "distanceKm": 643,
      "topology": "linear",
      "tradition": "christian",
      "path": "routes/st-olav-ways-gudbrandsdalsleden",
      "pilgrimage": "st-olav-ways",
      "ways": {
        "stageCount": 24,
        "bytes": 709224,
        "placesPerStage": 1.8,
        "sparse": false
      }
    }
  ]
}
